text,S,H,V,HR,SH,S3,H2,V2,N
porn video hd model futa spitroast double blowjob person double blowjob mtf fisting step sister horny wants step brother real bruised ass one whips girlfriend whip tags mature lesbian spanking girlfriend fetish duration mins added month ago tags mom milf lesbian spanking mother taboo threesome group sex orgy redhead top trending playlists view pornstars sabrina rose person age regarded delightful highly discreet independent courtesan service provide goes beyond expectations new videos organization porn images double blowjob fishnet mmf softcore sport fishnet double blowjob mmf lesbian fishnet search pssucaiinfo mature pauline interestingnatural magic young lady able visit hotel travel companion pls write email details dear gentlemanslooking forward person porn archive blowjob doctor lingerie sex first time double blowjob spank messy organization double set deep throat sluts open holes take big black white cock mouths full tight asses destroyed hardcore anal swap cock taste others pussies lesbian fishnet anal fucks asian video description ic,1.0,0.0,0.0,0.0,0.0,0.0,0.0,0.0,0.0
thats strive nothing europeans whiteness next godliness women least avoid carotenoid rich foods including even yellow butter fear getting pigmentation,0.0,1.0,0.0,0.0,0.0,0.0,0.0,0.0,0.0
persons bio gtm luckly got toxic relationship time student university technology casual alcoholic think bio helped roast upvote comment think doesnt downvote youre sure leave others decide,0.0,0.0,0.0,0.0,0.0,0.0,0.0,0.0,1.0
lay head chest pulls covers us goodnight babe night love person love fall asleep excited tomorrow one year anniversary heyyy sorry havent updated like forever ive reallyyyyy bussyyyy well thanks much reading far much come love person find buzz join start sharing creativity passion,0.0,0.0,0.0,0.0,0.0,0.0,0.0,0.0,1.0
men confident enough approach always impress love wolf whistled love attention dont understand women get offended view massive compliment men becoming unsure around women becoming lame women complain mens inappropriate behaviour someone whistled ones blame,0.0,0.0,0.0,0.0,0.0,0.0,0.0,0.0,1.0
come nyc sell couple bridges cheap believe evil hate us arent muslim follow sherry law yes enemy enemy must destroyed um er course realize promoting killing dont agree line thinking realize makes hypocrite bit moron eh toughguy cnn ur email tryd senttins daily need stop sending emailspnm always amazes people would even trust government taxes somehow fine trusting government decide lock life without benefit trial good point stop,0.0,1.0,1.0,1.0,0.0,0.0,1.0,0.0,-3.0
give couple examples person hits thing really liked anger management,0.0,0.0,0.0,0.0,0.0,0.0,0.0,0.0,1.0
gtif billion lobsters red lobsters red definition example people born without two legs doesnt mean definition humans bipedal actaully made want kill understand definitions need apply every context science facts work gtwhy would date either two people compatible would rather single person really dont know hypotheticals honestly need explain comparing contrasting works literally need give th grade science lesson gtmy definition woman would individuals typically equipment birth children almost always xx ah ylu call people uteruses younger 9 sterile post menopause dont equipment birth children women,0.0,0.0,0.0,0.0,0.0,0.0,0.0,0.0,1.0
mother much luck names men,0.0,0.0,0.0,0.0,0.0,0.0,0.0,0.0,1.0
warning child abuse story persons parents didnt use death reaper seal still alive person somehow given power unlock rinnegan read find outfirst fanfic strongsmart naruto au disclaimer naruto auoocip oneshot person secret best friends person chubby unpopular blonde got constantly teased looked,0.0,0.0,0.0,0.0,0.0,0.0,0.0,0.0,1.0
well really issues talking girls pretty feminine talk mirror like real thing,0.0,0.0,0.0,0.0,0.0,0.0,0.0,0.0,1.0
look understand dad unique outlook life even daughter person let first let know theyre happy accidents,0.0,0.0,0.0,0.0,0.0,0.0,0.0,0.0,1.0
quarter century ago small crack appeared facade evil empire crack following years widened despite desperate efforts plaster eventually became giant fissure brought whole edifice ironically one mans jump wall nine years later led wall coming august 9 discontent among workers shipyards gdansk polish baltic coast finally boiled strike action commenced young electrician fired management political activity heard strike climbed wall shipyard join friends colleagues quickly become leader name person rest history person would say end history courtesy organization via eight time remember family cut short holiday sea things started heating gdansk everyone fearing repeat 9 striking shipyard workers suppressed much bloodshed communist security forces didnt quite turn way thank god even martial law year half later proved particularly violent long revolution culminated events 99 relatively bloodless historys standards whatever injustice communist oppression poles others never resorted blowing others press political point yet end victory sign times closure sorts person wall jumper nobel peace prize laureate one best known icons end twentieth century announced celebrations twenty fifth anniversary polish august quitting solidarity person says solidarity social movement become simply trade union run new generation professional organizers polish good im thinking better testament overwhelming success organization normal trade union blogging topic later month,0.0,0.0,0.0,0.0,0.0,0.0,0.0,0.0,1.0
think saw yesterday protesting glasgow could someone else mean look,0.0,0.0,0.0,0.0,0.0,0.0,0.0,0.0,1.0
blackies must go back africa israel pl vacate,0.0,1.0,0.0,0.0,0.0,0.0,0.0,0.0,0.0
oh kinds turning tides let tell something go look baby time try wrap head around fact women murder little guys outright feel nothing order may continue totally unrestrained sex whoever want try imagine someone showing baby saying lot really hot sex chop infant child pieces first dont worry going ship chopped body parts facility experiments never wrap head around youre man soul men actually give shit shit look whole women seek fulfill fleeting frivolous vapid desires within moment,0.0,1.0,0.0,0.0,0.0,0.0,0.0,0.0,0.0
ahhhhhh person yelled buried cock deep butt id like get one smile said person directing camera didnt complain said wondering going follow person leads plane actually organization dealership use owned persons father got rental companys number sticker car dialed cell finish outfit put heels walked bathroom hair free asian big tits tied locked trapped wonderful cock knot swollen inside come person crawled next swung leg head sat sweet cunt mouth mom said girls wanted brake hang pool heat walking toasted im longlost mattress fell asleep person belly hardened like clenching fist person shrank wall mix surprise terror phone completely forgotten classy girlfriend gapes spread booty deflo smiles triumph pussy begins hummmmmmm suck clit fingers gently fucking im going go take shower allowed come idea body capable spread legs wide hips wriggled pushing persons steady thrusts looked gladiators lobby mission dump load fast could,1.0,0.0,0.0,0.0,0.0,0.0,0.0,0.0,0.0
thats body positivity movement says cant know someones health looking importantly preaches acceptance selflove sizes treat anyone differently size force people say believe anything healthy,0.0,0.0,0.0,0.0,0.0,0.0,0.0,0.0,1.0
im time allow vulnerable feel safe right man dont rush process,0.0,0.0,0.0,0.0,0.0,0.0,0.0,0.0,1.0
everybody saying definition broken except young child teach perhaps definition invalid brainwashing dont teach random child woman definition claims guess defines woman early life seeing adults call sort person woman ask kids identify woman lineup try find physical characteristics child reach definition unless taught specifically forcefully illminded adults,0.0,0.0,0.0,0.0,0.0,0.0,0.0,0.0,1.0
think hes got better chance happy would come closer instead lying kids,0.0,0.0,0.0,0.0,0.0,0.0,0.0,0.0,1.0
yeah kinda mom wouldve given piece cardboard letting use tv screen table sksks,0.0,0.0,0.0,0.0,0.0,0.0,0.0,0.0,1.0
right treating people fairly neo marxism unsustainable right thing pretend everything bad happens everyone always deserved never try help anyone dont need help also right wont anyone take seriously guys divisive,0.0,0.0,0.0,0.0,0.0,0.0,0.0,0.0,1.0
way could use suck clit drove crazy squirmed moaned pleasure continued suck clitoris inserted couple fingers dripping wet pussy went nuts slid long fingers tongue bathed clit kept calling name really pulling hair could tell way grinding pussy face getting close gasps confirmed breathing became heavy moaning groaning really working tongue started letting really high pitched shrieks felt body start quiver pushed pussy face began orgasm could feel juices flowing lapped every drop could reached climax pushed face away body writhed ecstasy bed wanted continue eat wouldnt let couple minutes climax ended dick rock hard saw told wanted fuck big dick mine climbed top slid length dick back forth wet pussy lips didnt want anything teasing reached grabbed cock placed head right pussy thrust hips upward time pushed let scream oh shit said feels good baby fuck hard loving nephew happy oblige favorite aunt lifted weight upper body onto hands leverage could fuck nice hard like wanted lifted legs air pussy completely exposed fucked really long hard strokes still remember slapping sounds making bodies collided one another really enjoying another position mind beautiful ass wanted fuck behind slid cock told get hands knees must reading mind time ready waiting looked good back arched face pillow perfect ass air positioned behind placed hands hips slid full length dick inside eager pussy felt pushing back started sliding started fuck real passion met every one thrusts one sight ass jiggling time bodies connected something behold turned much fucked much harder reached grabbed handful hair used pull back onto made back arch much already perfect wish camcorder rolling would good porno ive seen bodies bucked started fuck even harder grabbed ass cheeks squeezed exquisite cheeks big hands took right hand started spanking left ass cheek really turned got even vocal spanked even harder something seeing milky white ass turn beet red started get feeling balls started slow little order try make last long could wanted none told keep fucking said want cum deep inside baby could hear breath quicken started panting kept fucking hot pussy hard could became almost frenetic verge coming im cum aunt person said go ahead baby let loose shooting load feeling cum inside must set came never made love woman way came laid top little completely amazed fucked aunt person bed anyway common sense got better us realized better lay much longer washed straightened one would suspect anything got home began year affair us ended went away college recently rekindled years ago family function,1.0,0.0,0.0,0.0,0.0,1.0,0.0,0.0,-1.0
thats terrible reply rape nature tends happen private places spent least second think hitting ol reply button one write lot reddit almost exclusively social issues never ever seen anything close,0.0,0.0,0.0,0.0,0.0,0.0,0.0,0.0,1.0
live berkeley one days im going pick girl right im cum riding doggie style lean whisper ear punch back head hard please post video happens would clever heroic especially knowing would fuck sex life years know time men started real retaliation failures hereby proclaim winner charm school award snark pseudoman would learn state point without feminine sarcasm maybe wed respect wouldnt hold breath respect persons sock puppet may wife latest posts tone shows probably woman lets go crazy,1.0,0.0,0.0,0.0,0.0,0.0,0.0,0.0,0.0
ego never said high iq sure wouldnt spend time money iq test im saying iq affects many things life sad something youre born big influence life thats reality genius like person person life would much better id grad school wouldnt feel inferior would know im intelligent 99 plebians see everyday life,0.0,0.0,0.0,0.0,0.0,0.0,0.0,0.0,1.0
bitches think theyre slick matter hard try hide still tell theyre hoes,0.0,1.0,0.0,0.0,0.0,0.0,0.0,0.0,0.0
nice see hes taken art youll greats like person pretty big shoes fill probably equally big mom fill well,0.0,0.0,0.0,0.0,0.0,0.0,0.0,0.0,1.0
yeah sure get girlguy consented theyre midway heshe something dont like theyre quiet itdoesnt enough confidence revoke consent tell partner violates boundaries fair go around friends say raped willingly went intercourse never revoked felt like revoked would offender know crossing boundaries victim doesnt fully express physicallyverbally goes heshe feels like thats way,0.0,0.0,0.0,0.0,0.0,0.0,0.0,0.0,1.0
man looks like type guy talk body pillow like danm girl already cheeked friday calm,0.0,0.0,0.0,0.0,0.0,0.0,0.0,0.0,1.0
source organization neuropathologica october category neurology source type research evidence intraneuronal accumulation preceding tau pathology entorhinal cortex abstractgrowing evidence gathered transgenic animal models alzheimer disease ad indicates intraneuronal accumulation amyloid peptides early event ad pathogenesis producing cognitive deficits deposition insoluble plaques,0.0,0.0,0.0,0.0,0.0,0.0,0.0,0.0,1.0
youll run successful food truck microbrewery enjoy learning debt hard way,0.0,0.0,0.0,0.0,0.0,0.0,0.0,0.0,1.0
thank got parents th birthday tradition wear untilif get engaged,0.0,0.0,0.0,0.0,0.0,0.0,0.0,0.0,1.0
okay whos going working posts everybody moves better jobs quits cant support basic necessities,0.0,0.0,0.0,0.0,0.0,0.0,0.0,0.0,1.0
fucking friends little angel sucking dark dick hopes chocolate cum help take loading next set images confiding dark lover mom helping take bbc mouth biggest dick shes ever seen dont let parents hear massing thick black cock white ass black cocks favorite paying black cock innocent pussy,1.0,0.0,0.0,0.0,0.0,1.0,0.0,0.0,-1.0
jave guy friends going tough time tell man help dont sound like good person,0.0,0.0,0.0,0.0,0.0,0.0,0.0,0.0,1.0
pur rap xxx pron hindi took seconds look thanks size ill admit impressed xnxx boys xxx american black yes xxxchalid school exquisite pain exquisite tit torture viagra reviews xl girls xxx would reward good behavior babyxxx com could never ashamed missalice tits slid shaft engulfing soft flesh www allsorak pornstories com person popular repeated haze blackedvirgin vom gave address disposed trays parted without person giving arm gentle squeeze im really looking forward tonight person ingredients viagra telugu new heroins sex imges replied person gawar bhabhi tv serial xxx photos massaged persons clit leaned close ear miss hear sxxtamilcom first make cum times licking pussy fuck hot xse xxx xxx person ray,1.0,0.0,0.0,0.0,0.0,0.0,0.0,0.0,0.0
hope youre still standing staying strong op going history thought id check ,0.0,0.0,0.0,0.0,0.0,0.0,0.0,0.0,1.0
balancing system nice personally dont like much polarisation become nasty prevent constructive feedback course opposite huge problem look happening israel,0.0,0.0,0.0,0.0,0.0,0.0,0.0,0.0,1.0
poggers whatever twitch niggers say days new video supposed make feel like man spends 9 video bitching thats male experience women bitching happen face got double chin video nothing special made purely motivated sponsorship arguments pretty funny big return youtube cash expressvpn check time like hate comments quits youtube good time,0.0,1.0,0.0,0.0,0.0,0.0,0.0,0.0,0.0
brazzers call centre coochie video download brazzers call centre coochie video download brazzers call centre coochie video download filipino sex images beegschoolgirlsex taza porno fimls maroc aunty xxx bra new hd kobayashi san chi maid dragon hentai lipuna name ringtone charmi kaur xxx fucking photos person arafat person primo flagra primo images person person vampire sex game inbiansexyvodes fairy tail person organization person aggrwal ke xxxx photos com bleach anime coloured xxx porn manga sister potn grosse chatte photo filme gratuito de sexo ceetzie porn closeronline organization person novinha com buceta apertadinha pre beach meets guy wants sex person xxx fucking photos pre pre filipino sex images everyday possible pornstar person accepts guy tape videocamera fuck working time ,1.0,0.0,0.0,0.0,0.0,1.0,0.0,0.0,-1.0
inferior faggots many long felt darkness withinone fear long surrender seduces drives compels seek person person whispers dreams saying hole need used deserve abused,1.0,1.0,0.0,1.0,0.0,0.0,0.0,0.0,-2.0
 stink article states group people believe constitution laws desire live laws allowed united states america period lets enforce rid problem gets hand lets deport person put moslem bullshist action nothing little bird left fence correct quan says kill infidels muslim somehow congress shut get rid need let muslims run country needs go back somalia muslim country wrong state electing position,0.0,1.0,0.0,0.0,0.0,0.0,1.0,0.0,-1.0
person address portland odtwlm purify blood ww persons celebrate person organization 9 cure dyspepsia wonderfui virtue oregon wild grape bow urine doom nnont bllllzrs unimpoonrurof bltleu taken immedi tcly 99 meal lm cure dyapepulnt person rmy ,0.0,0.0,0.0,0.0,0.0,0.0,0.0,0.0,1.0
instead tell new boyfriends sad stories sad russian accordion playing background sympathize pity current boyfriend one racist redneck fuck looks like rat pimples crusty lips smells like harbour last summer win child best pop another child world im kinda favor im fucking sick women call selves single mothers single youre downtown every chance get sleeping men anyways baby mama youre expired high mileage stretch marks body even calves teeth rotting slowly surely good life living like piggot shit together,0.0,1.0,0.0,1.0,0.0,0.0,0.0,0.0,-1.0
well shit cant find either last th july one article floating ive photos phone year ive showing people ever since cant find damn story sorry must somewhere,0.0,0.0,0.0,0.0,0.0,0.0,0.0,0.0,1.0
related videos cute straight guy two handed stroke hard laugh gay bloopers love birthday pissing ass fake hostel two hot girls get stuck bunk bed 9 funny slut person gets wow orgasm fingering vellicating wet cunt marafun nice body painting person makes funny solo piano show penis organizationmy mom sister make watch snd fuck smokin hot sex funny ashe overwatch animation hysterical charlie play french 9 cock ninja studiossister fulfills brothers dying wish full video unpredictable cumsots compilation part police officer catches cum public uncensored tape full video latina foxtail anal sex vid9mp funny porn fails bloopers compilation 9 ,1.0,0.0,0.0,0.0,0.0,1.0,0.0,0.0,-1.0
mail order bride website selling im buy live canada,0.0,0.0,0.0,0.0,0.0,0.0,0.0,0.0,1.0
 seratone ok lets get back ic person basically need resolve recover person person person right person person stones persons weave whip againt persons face mekhet feel beast direct jaws around neck like whip feels fortifying vitae within system lessen person damage vitae person static turn person yup static holy crap success person eyes open wider ever feels crazy bitch start drain precious vitae somewhere inside dead little heart summons enough strength let hellacious get fuck crazy bitch,0.0,0.0,0.0,0.0,0.0,0.0,0.0,0.0,1.0
think brings us ops point long clear verbal consent provided suggest perhaps considered true consent even person really drunk basic premise one gets really drunk consents sex thats person made bad decision decision much like hold responsible decision drive even blackout drunk time although kinda see point also feel space needs reserved discuss person taking advantage drunk person manufacturing situation idea yr old cougar getting frat boy drunk take advantage 9yr old cock feels like rape made bad decision,0.0,0.0,0.0,0.0,0.0,0.0,0.0,0.0,1.0
country big victim mentality problem perpetuated political correctness white guilt pretty messed sad many black people think like really trips white guilt far left nut jobs tried explain woke ally white friend difference racism systemicinstitutionalised racism oh boy haha vehemently denied different dictionary definitions insisting impossible racist white people,0.0,0.0,0.0,0.0,0.0,0.0,0.0,0.0,1.0
pre pre interracial vintage anal person person pre owner fuck slavefucking videos pre lucy thai xxx url pre pre person called neighbor girlfriend person guest gay balls deep pre pre two babes look really hot dressed stockings sexy lingerie girl big tits gets fucked angel revenge sexy skinny brunette babe gets cherry licked gives lover hot blowjob watch slut getting pussy asshole pumped cock meat awesome scene turns around filmed guy massaging pussy lips pre pre gauge interracial turns around filmed guy massaging pussy lips angel revenge sexy skinny brunette babe gets cherry licked gives lover hot blowjob watch slut getting pussy asshole pumped cock meat awesome scene pre sexy little person acting damn fool person fuck sense,1.0,0.0,0.0,0.0,0.0,1.0,0.0,0.0,-1.0
parties far apart needs peaceful split cities rest country otherwise track something bad,0.0,0.0,0.0,0.0,0.0,0.0,0.0,0.0,1.0
thinking france bad hating white people thats different claiming criticizing china sinophobic,0.0,0.0,0.0,0.0,0.0,0.0,0.0,0.0,1.0
nah got little shot want dont get control everyone else anymore,0.0,0.0,0.0,0.0,0.0,0.0,0.0,0.0,1.0
mistress filled hand shaving cream person looked mistress mean shaving cream mistress smeared white foam persons head thickly person moaned squirmed mistress rubbed scalp covering stubble picked straight razor counter person wanted stop wit buzz cut stubble could pass radical short cut bald well another story would suggest stay still whore person sat still terrified longing hair back reality wanting cry shave mistress shave bald beg make shaven bald whore mistress scraped away remaining hair persons head leaving bald smooth clean hard sharp blade leaving nothing behind suddenly unexpectedly person came wave sensation,1.0,0.0,0.0,0.0,0.0,0.0,0.0,0.0,0.0
 fault drunk drunk excessively drunk top clear cut instance entirely fault sorry taken advantage like situation safe friends around please dont blame healthy considerate person sex another person blackout drunk sober,0.0,0.0,0.0,0.0,0.0,0.0,0.0,0.0,1.0
even experienced shoplifters never spotted never dreamed bland attractive young woman looking carefully absorption jewelry silk lingerie standing beside apparent abstraction though couldnt quite decide whether go upstairs next persons spring ensemble take turn blouse department fact watching fingers recording alert mind every visible detail physical personality checking two hundred photographs well known store thieves hung open rack persons office,0.0,0.0,0.0,0.0,0.0,0.0,0.0,0.0,1.0
dont sleep long wake take action immediately didnt invite chose come live luxurious life free healthcare free housing free education free food free entertainment etc called free loaders nothing freeloaders attack innocent person police cant anything must say dont want come dont want stay dont want live want live support want attack people work hard pay taxes rob rape fight back full,0.0,0.0,1.0,0.0,0.0,0.0,0.0,0.0,0.0
think drug called shatter post tilted saturdays shatterdaaayyys love life blessed bunch emojis,0.0,0.0,0.0,0.0,0.0,0.0,0.0,0.0,1.0
person 99 insignito di medaglia doro al valore aeronautico alla memoria mor un incidente aereo avvenuto nella citt mercuriale durante una esibizione delle organization sacrificando la propria vita per evitare di causare vittime fra il numeroso pubblico presente,0.0,0.0,0.0,0.0,0.0,0.0,0.0,0.0,1.0
would make joke hair unique cant think way relate anything,0.0,0.0,0.0,0.0,0.0,0.0,0.0,0.0,1.0
soft dark hair beautiful blue eyes huge breasts perfect ass amazing soft skin almost good true top years old young tiny pussy big vibrator see happens person orgasms first time video,1.0,0.0,0.0,0.0,0.0,0.0,0.0,0.0,0.0
calling cops bastards hate speech think say trans people cant hate speech people always gaslight,0.0,0.0,0.0,0.0,0.0,0.0,0.0,0.0,1.0
ive always seen like places one post opinions would shot public discourse many people secretly agree upvoting truly unpopular ones would basically make top posts intentionally shit opinions like start killing babies live tv mean yay came terribly shit opinion unpopular everyone makes sense upvote something actually agree wouldnt support public secretly agree sense one different one thats mostly one autobans opinions using wrong words wrong political leaning,0.0,0.0,0.0,0.0,0.0,0.0,0.0,0.0,1.0
vegans suffering prejudice way people rape homophobia racism etc vegans see happening animals unfair highly cruel treatment want stand oppose saw someone beating dog street im sure would get angry try stand dog exactly,0.0,0.0,0.0,0.0,0.0,0.0,0.0,0.0,1.0
organization power make people look like would limes coke liter henney magic,0.0,0.0,0.0,0.0,0.0,0.0,0.0,0.0,1.0
climbed british rankings shown compete top athletes sport around world last year example narrowly lost world number three agegroup european championships showing even though great britain doesnt fund sport levels countries still able compete best moment dream olympics started become ambition goal mine believe right training continued drive support make reality,0.0,0.0,0.0,0.0,0.0,0.0,0.0,0.0,1.0
sikhs carry small ornamental knife religious law changed jihadists tried invade land every man must carry sword kill muslims bent killing ornamental knife still carried meets minimum requirement law custom sword longer really effective weapon jihadists goatfuckers need another object lesson theyll use guns time,0.0,1.0,1.0,0.0,0.0,0.0,1.0,0.0,-2.0
