text,S,H,V,HR,SH,S3,H2,V2,N
mappa prostitute vercelli annonces libertini sexe incontri sesso arezzo annunci erotici brescia erotismo hard giochi erotici foto giochi erotici gay incontri online gratuiti matura cerca di uomini yucatn siti dove scopare www bakekaincontri roma annunci escort brescia film italiani con scene di sesso chatt con donne mature casting porn video person site rencontre reunion maurice donna cerca uomo crema badoo chat app les trois garcons london donne separate fuenlabrada film erotco chat gratis italiana incontri gay torino bakecaincontri cuneo video ponno gratis cerco donna per compagnia scopare subito chat online gratis senza registrazione ,1.0,0.0,0.0,0.0,0.0,0.0,0.0,0.0,0.0
server set websslhstsenabletrue server set websslhstsmaxagephonenumber server set websslhstsincludesubdomainstrue info url force colored output builds commandbox wont use ansi color formatting running inside noninteractive terminal,0.0,0.0,0.0,0.0,0.0,0.0,0.0,0.0,1.0
recommend hotel eskorte oslo norsk australian dating sites friends lav ikke ndringer xxx video solfylte leone video solfylte leone video det medflgende stik canon viser sin arv fra en kameraforskjellene er der men virker serie beregnet semiprofesjonelle strre nr vi beskriver dem enn de det er rett og slett ikke samme rike innstillingsmuligheter hos eos sony iso hva liker menn inga ny kjreste von alder mark ii som hos de andre alt forandret seg dramatisk med advent av hitler hvordan ha samleie video dele bilder pt klasse leather imitations leather animal skins hides trunks travelling sex date bergen selda ekiz naken bags umbrellas parasols walking sticks whips harness saddlery boxes leather leather board nr det gjelder basene livmortappen ved tidlig graviditet knullefilmer ubter tyskerne spredte dem hele verden tilbake frste verdenskrig person ekstrem porno video fot fetish chat site datering feilmargin ligningen gokart med crash og vennene hans og fiendene er tilbake til tv hjelper deg tester erotisk massasje oslo konsoller med splitter ny grafikk og nye funksjoner denne enkle og kjempegode desserten lager du raskt da forlater den stolte fornyde godt humr person ha inoltre proposto che il governo mens de andre tjenestene prver skreddersy innholdet til akkurat deg har tidal en litt videre ramme hvor man fr flere inntrykk hovedinngang til trn sachsenhausen var en tysk og sovjetisk konsentrasjonsleir som var drift fra til kulturskolenes musikktilbud tid en lreplananalyse siw graabrk nielsen norges organization professor organization person norges organization professor organization de nordiske landene har lenge vrt anerkjent som foregangsfigurer nr det gjelder innlemme populrmusikk grunnskolens musikkundervisning finn ever date princess bubblegum seg kjresten en signifikant prosentandel av saltklyparedaksjonen venter barn,0.0,0.0,0.0,0.0,0.0,0.0,0.0,0.0,1.0
billions burgers ago milkshake mixer salesman convinced couple guys new hampshire nofrills restaurants operating southern california go national editorials checked backtracking person still breaks promise persons flipflopping organization audit represents broken promise governor unwilling hold administration accountable seeks federal office testing vote listening secretary person state organization committee must decide request several localities want try new voter checklist equipment fall secretary state person rat trap person caught lies candidates think able tell truth longer qualification running organization take example democrat person bedford spent two listen ive got careful presidential folks person said welcome guest views left january 9,0.0,0.0,0.0,0.0,0.0,0.0,0.0,0.0,1.0
share twitter url like us organization url follow pinterest url follow twitter url check website url share healthy summer desserts children make green ice pops recipe video url,0.0,0.0,0.0,0.0,0.0,0.0,0.0,0.0,1.0
organization claimed responsibility strasbourg attack person organizations propaganda wing describing person soldier responding organization call organization used similar language previous claims responsibility indicate person likely radicalised organization propaganda directly commissioned group direct ties organization,0.0,0.0,0.0,0.0,0.0,0.0,0.0,0.0,1.0
build standalone applications ios android one configuration file provide quick publishing app updates create new builds android ios expo one click uses javascript extension jsx keep syntaxes shorter simple easily pairup laravel php framework app development ,0.0,0.0,0.0,0.0,0.0,0.0,0.0,0.0,1.0
carmina burana least first part fortuna probably one immediately recognizable lyrics weve discussed far class sorts media tv films film previews sometimes sampled music course immediately bring mind things particular notably hear fortuna think battle helms deep lord rings trilogy however despite prevalence never occurred look lyrics incarnations prior persons arrangement 9s looking lyrics original form translated actually bit confusing anticipated general message lyric start seems quickly luck changes good bad cruelty immutable fate request speaker audience mourn said cruelty alongside however pretty long winding lyrics turn back initial song several times interspersed love songs borderline erotica drinking songs something bit nonsensical roast swan odes seasons winding always coherent theme behind lyrics set kind jarring read compared solemn dramatic tone fortuna particular another things jumps rhyme scheme meter particularly remarkable never really considered rhyme scheme prior reading lyrics person version im familial grand orchestral done rather melodramaticsounding choir doesnt seem leave much room whimsy rhyme meter words sort gets lost behind sounds rest song,0.0,0.0,0.0,0.0,0.0,0.0,0.0,0.0,1.0
basketball tournament team fiveonfive singleelimination event held june philadelphia include organization alumni 9 organization final organization team organization team well alumni wisconsin organization siena maryland,0.0,0.0,0.0,0.0,0.0,0.0,0.0,0.0,1.0
 phonenumber transfer experience determination tax rate consolidation purposes ors employing unit total successor experience employing enterprise substantially components parts employing enterprise transferred otherwise acquired employing unit including employees necessary carry daytoday operations essential business functions manner purposes carried prior acquisition transfer,0.0,0.0,0.0,0.0,0.0,0.0,0.0,0.0,1.0
 visit us url organization go url follow organization twitter organization follow organization organization url follow organization organization url download free clns media mobile app ios googleplay,0.0,0.0,0.0,0.0,0.0,0.0,0.0,0.0,1.0
presentation signifies one two meanings well organized easy understand web building tutorials lots examples use html css javascript sql php python bootstrap java xml sources list shortcuts active source selected general copy source ctrlc paste source ctrlv remove source del order move source sources list ctrlu however wondering hotkey shortcut button combination could use sort like virtual kvm switch lets select one display another specifically without needing,0.0,0.0,0.0,0.0,0.0,0.0,0.0,0.0,1.0
evidence veneer texas look huge collection pictures respective conventions almost old white men oh organization republicans denied booth philosophically inconsistent party platform huge amount diversity age race size gender including proudly lot glbtq respective platforms eventually reflected state policy example real lobbied protested houston passed citywide antidiscrimination law behalf organization houston thus last major city pass ordinance concrete example local laws passed democratically controlled areas even red state texas,0.0,0.0,0.0,0.0,0.0,0.0,0.0,0.0,1.0
surprisingly organizations clients include whos organization including organization organization organization organization organization organization organization organization organization organization organization organization organization among others,0.0,0.0,0.0,0.0,0.0,0.0,0.0,0.0,1.0
imprint area side wrap shipping weight 9 shipping qty must add per case damageresistant boxes,0.0,0.0,0.0,0.0,0.0,0.0,0.0,0.0,1.0
organizations credit ratings assessments opinions publications intended use person benchmark term defined regulatory purposes must used way could result considered benchmark,0.0,0.0,0.0,0.0,0.0,0.0,0.0,0.0,1.0
dockerfiledockerfile bash run wgetrun curl,0.0,0.0,0.0,0.0,0.0,0.0,0.0,0.0,1.0
russian swinger live free porn sie sucht ihn sex sankt bernhardt schmutzige geschichten kitzler stimulation franzosische sex filme porn anime sites ich bin jungfrau pron straponsex parkplatz fick sex frei partnerborse schone hausfrauen khler kostenlossex filme anschauen sie sucht sextreffen camelto pics privat hausfrauen ficken erotische filmchen free bisex porn ao huren magdeburg niedersemar sexse porno hairy cunt tubes frau aus osteuropa kontaktanzeige immer dicker kostenlose kontaktanzeige aufgeben porno videos watch online private kontakt sie sucht ihn ao porno filme zum anschauen wichsen sport rein sind mde erotik massage free swinger videos free celebs porn schonsten titten muschi rasieren bilderlernen mit speed dating tipps die forschung und lage wo ich werde den terror wirklich ihre privatsphre und sexy free anime porn onion bootynach unten darber hinaus werden verschiedenen interessen abgesehen nicht wahrdas plakat sagen ich versuchen zu erziehen ist das beauty lernen ass tube es oben sondern ohne strand bilder frau ist geil leipzig dating spy cam porn neubruck usa online dating hausfrauen sex kontaktanzeigen ruhrgebiet kontaktanzeige schreiben handy porno seiten geile nackte fotzen gratis hartcore pornos greuda singles borsen free porno neu gratis sex movies erotische rollenspiele porni sex film big ass mobile suche frau furs erste mal enormous ass url porno mollige frauen erotik bilde porno filme deusch pornography free videos deutsche porn seite blond oder braune haare onanieren testosteron leuchtenburg sex lubeck kontakte sex sm chat hamburg und nord new deal breaker fr eingesetzt wir bieten ihren zahlungsplan und ein persnlichkeits profil ich war auf ihre partner und ihr datum nchte fr person mdchen und ihr verhalten eines babys sugardaddy ist entfernt diese beiden registern und zusammenarbeit unterliegt daher dass eine beziehung eine ziemlich auf einen hohen metabolischen rate ist eine beziehung arbeiten und anspruchsvoll oder asiandate datenschutz policy nicht schtteln br gemeinsam sind nur durch mitglieder ber etwas erfolg eine absolut sicheren ehemann affre uk dating sites mit blonde typ der einzige grund dafr schwierige welt haben biege tricks lernen ein bisschen anders als ohne den hintergrund es gibt angenehmen erlebnis angenehm wieder vereint dies ist dativ aber die auf der einer sex mom clip sex webcam kostenlos sex old women sex dulmen verschrfen eine dating service sex cam shows normale frauen nackt sich fr langfristige beziehungen und wenn er auf sexy wife stories vorbereitung zum analsex freier deutscher porno nackten mann black big boobs single gothic sie sind schrecklich fotograf darzustellen und nicht seine freunde und ich denke ich bin vllig lssig partner sind websites fr sie ging dann gibt mglichkeiten nachgedacht nur live sex tube junge mutter nackt jam effekt zu schtzen und disharmonie sind sie nicht warten sie werden das gold und sagen beheben wir,1.0,0.0,0.0,0.0,0.0,0.0,0.0,0.0,0.0
received email today someone read page im placing general public interest please feel free commenton pm xxx wrote xxx email subject poor pr message body either want foreign guests dont dont want us make english website want us number japanese skiiers gets less every year write manners polite respect local culture myoko people generally friendly always willing help foreign travellers unfortunately resorts foreign skiers show scant respect local culture ways irreparable damage may result establishments shying away allowing foreigners going go halfdozen friends spreading organization must noted person brave enough use hisher name heshe using false email case writer looks reply obviously bouncedhi xxxif want come disrespect local culture yes please dont come foreign guest free pass act like dickthanks feedback please enjoy nisekoregards mg,0.0,0.0,0.0,0.0,0.0,0.0,0.0,0.0,1.0
looking like broken condom emotefreeemotespackragegifemotefreeemotespackragegifemotefreeemotespackrage,0.0,0.0,0.0,0.0,0.0,0.0,0.0,0.0,1.0
nearly year delay station launched high definition newscasts along revised logo new graphics september 9 pm newscast organization became third station cincinnati market organization organization channel 9 second organization group organization make upgrade,0.0,0.0,0.0,0.0,0.0,0.0,0.0,0.0,1.0
say front wasnt easy far hardest biggest thing ever sub far couldnt make without help friends person timed songs probably lifted burden organizations person fellow person encourages checks english throughout process also chipping vimeo plus account could find place upload video person checks japanese fixing errors person encoding uploading massive video finally birthday girl sole reason wanted lot year saw highs lows sometimes couldnt much cheer cry laugh hope feelings conveyed somehow throughout whole thing one thing certain love grows stronger every day heres another year full laughter full joy full hope may achieve everything want life may support every way happy birthday russian monkey torrent link softsubs mc portion matches raw got ho,0.0,0.0,0.0,0.0,0.0,0.0,0.0,0.0,1.0
continuing use website agree changes terms use changed information please click continuing use website agree changes,0.0,0.0,0.0,0.0,0.0,0.0,0.0,0.0,1.0
hi uiwilleatyourfacecunt thanks submission rroastme unfortunately post removed following reasons joke roast joke roasts allowedurl wish submit animal please visit rroastmypet feel removed error please message usurl may review,0.0,0.0,0.0,0.0,0.0,0.0,0.0,0.0,1.0
example write schema data file call writexml method follows dim dsts transcriptdata dstswritexmltranscriptsxml xmlwritemodewriteschema optional second argument writexml method affects data written file using xmlwritemode enumeration also set ignoreschema write data diffgram ,0.0,0.0,0.0,0.0,0.0,0.0,0.0,0.0,1.0
enter code show love flag video page youre trying access home dmca yboys images website licensed comply usc melanie fuck sister thank security code always working towards adding features keep love porno alive well generate gif added,1.0,0.0,0.0,0.0,0.0,0.0,0.0,0.0,0.0
anyone wants sit crazy months theres lot pleasure simplicity go see organization think person crew leave new appreciation hankering old record critics notebook pushups hard hear unless near stage apparently fan adamant pushups majority organizations set exchange near top post person fended fitness requests least twice pushups stage im dress explained buts stage unless easiest round applause person earned night parting shot exiting fillmore typical traffic flow duo front two twentysomething guys feel like bands always know theyre going give encore indulgent right setlist goodbye crazy want know new song summer mood last year place early morning new song one like want fear identity organization release dreams organization cover sun dont shine deal become organization release fade away new song always baby person cover want scrubs organization cover im everyday love like used boyfriend person,0.0,0.0,0.0,0.0,0.0,0.0,0.0,0.0,1.0
quest trace vine ancestors jevington spent night hastings first visit amazed tall black timber sheds storage seafaring equipment days everything continue reading last thirty years reports feeling lonely us doubled many countries including australia people live ever elderly isolated illness frailty many far family continue reading molly gives us strength carry little girl four way around mollys lost hair smile theres bug inside see get rid continue reading person finding difficult coping mothers yearly visit harsh disciplinarian kids expected day thought invariably counterproductive yet person takes duty help instil manners grandchild continue reading person holding daughters st birthday party small weatherboard hall miles anywhere fortyeight sister person looked vibrant youthful smart hairdo trim white slacks summery top lingered outside twilight chatting continue reading ,0.0,0.0,0.0,0.0,0.0,0.0,0.0,0.0,1.0
add onenote taskbar debugging imagej netbeans add custom file extension netbeans exceptionshub adding netbeans html source editor dzone adding column jtable netbeans organization netbeans ide users add file chooser add image images panel gui use jlabel change icon property object display image,0.0,0.0,0.0,0.0,0.0,0.0,0.0,0.0,1.0
orders sent organizationorganization office address order phone voice phonenumberer tdd phonenumberer fax phonenumber report fraud waste abuse federal programs contact web site url email email automated answering system phonenumberer ,0.0,0.0,0.0,0.0,0.0,0.0,0.0,0.0,1.0
youre curious anything game development world leave comment tweet us askgamedev follow us organization url organization url organization url web url source,0.0,0.0,0.0,0.0,0.0,0.0,0.0,0.0,1.0
total hindu muslim christian sikh buddhist jain others stated total 9 99 male 99 9 female 9 growth population population sub district increased last years,0.0,0.0,0.0,0.0,0.0,0.0,0.0,0.0,1.0
slicemapslice,0.0,0.0,0.0,0.0,0.0,0.0,0.0,0.0,1.0
discussions continue discussions socialist person said friday apparently new zealand might part lost underwater continent geologists think part eighth continent zealandia search organization ,0.0,0.0,0.0,0.0,0.0,0.0,0.0,0.0,1.0
would amazingggg available ten minute genji offer switch towns like immediately sorry found genji homee emmalee would amazinggggare available ten minute genji offer switch towns like immediately signature lady gamer shares candid thoughts stop rioting get jobs hippies lol bells 9 catalog feedback wifi patterns personperson name person acnl town halcyon dream code af last active pm make sure code added come made someone ping turned im available nowi make sure code added come made someone ping turned signature put money bag stole keys last time ever saw bells catalog 9 feedback wifi patterns topic cycling offline aye,0.0,0.0,0.0,1.0,0.0,0.0,0.0,0.0,0.0
bag tasche hm cute one necklace kette hm delicate version jeans thanks guess one perfect fit beanie topshop love one shirt organization fur coat felljacke organization shoes schuhe zara person sale javascript currently disabled browser reactivate view content javascript currently disabled browser,0.0,0.0,0.0,0.0,0.0,0.0,0.0,0.0,1.0
 raw sql doctrine query object,0.0,0.0,0.0,0.0,0.0,0.0,0.0,0.0,1.0
providing global trading services realtime settlement trading fees lowest industry mention introduction innovative trading models transfeemining traders actually earn revenue via trading organization platform choosing organizationrganization lambda listing easy choice make organization benefit exposure receives highpriority listing organization platform solidifying brand key player blockchain dapps spaces,0.0,0.0,0.0,0.0,0.0,0.0,0.0,0.0,1.0
person yelled cut set mad max fury road final time filming crew amassed staggering hours raw footage leaving editing team near insurmountable task wrangling feature one coherent whole low behold persons longgestating sequel proved one inventive intense cinematic experiences last decade testimony directors deft touch despite chaos action sequences still relatively easy keep pace course deep reservoir footage fury road always going produce deleted scenes today trio cut clips surfaced online showcasing persons reign terror war rig making tracks across arid sunscorched terrain truth told theyre particularly remarkable scenes indeed deleted sequences rarely anything make us want rewatch mad max fury road moment bluray hits shelves looking afield though understood person pair mad max sequels planned organization locked person additional three fans film know well persons road warrior wasnt necessarily memorable character coming bombastic sequel title belonged persons onearmed badass person according organization organization least considering spinoff would focus rebel imperator though possibility adjacent film largely hinge whether person decides commit organizations spinoff actress hesitant mad max future past mad max fury road bring war rig tow persons triumphant sequel blasts onto bluray september ,0.0,0.0,0.0,0.0,0.0,0.0,0.0,0.0,1.0
sample scan click enlarge war services british organization officers 9 persons annual army list special reserve list territorial force list 9 includes section entitled war services officers active list covering serving officers regular army also officers militia marked special reserve territorials volunteers yeomanry,0.0,0.0,0.0,0.0,0.0,0.0,0.0,0.0,1.0
magpie saluteuebel organization hamburg germanysource zoom internal front 9 mics wav editing wav winoncd edited tracked tlh sbe fixed flac level ffpmdrecorded mastered person,0.0,0.0,0.0,0.0,0.0,0.0,0.0,0.0,1.0
organizations credit ratings assessments opinions publications intended use retail investors would reckless inappropriate retail investors use organizations credit ratings organizations publications making investment decision,0.0,0.0,0.0,0.0,0.0,0.0,0.0,0.0,1.0
letter stated administration provisions law practice department count service date enlistment date transfer fleet naval reserve naval service exception following time furlough without pay,0.0,0.0,0.0,0.0,0.0,0.0,0.0,0.0,1.0
intellectual paralysis political resulted muslims ccollectively unable put practice organization asks organization demands action human beings oppression tyranny poverty order establish peaceful society therefore muslims sit back hope others duty protecting life liberty children world unlike mr person muslims luxury simply declaring happen instructed god almighty creator take responsibility poor weak live oppression injustice moral duty struggle engage jihad oppression whatever means available us reality happen muslim children children everywhere challenge facing us finally break horrible cycle oppression still allows unimaginable suffering happen precious children world mrs person national vicechair organization professional family counselor recently visited palestine part factfinding medical team team visited refugee camps health care clinics hospitals orphanages local international charities womens refugee centres spoke social workers local palestinian families back top,0.0,0.0,0.0,0.0,0.0,0.0,0.0,0.0,1.0
summary token organization symbol nrx price nrc soft cap hard cap currencies eth btc total supply nrc nrx token created organization blockchain used internal currency paying various types information advertising services premium listing advertising press releases email distribution etc,0.0,0.0,0.0,0.0,0.0,0.0,0.0,0.0,1.0
cow killer ant urltbmischamptbouampsourceunivampsaxampeiiwru9a9jyfosgdgbampsqiampvedcdeqsaqampbiw9ampbih sort beetle related bug something sure related blisters found rove beetle url,0.0,0.0,0.0,0.0,0.0,0.0,0.0,0.0,1.0
reviews real 9 ram ram lbs pinterest reddit whatsapp share via easy everyone get year 9 ram reviews edson chrysler jeep handle constantly demanding requirements three engines available new 9 ram etorque rolling boardroom ram enjoyable drive matter environment situation work refined low frequency humming sounds best one get pickup truck segment tires mpg highway author new etorque mildhybrid technology operated using shifter vehicles sport performance hood lanekeeping assist system object wrangler toyota runner delete option like model fleet 9 ram looks terrific stash stuff inside 9 ram reviews ram tour de force modern pickup magic ride us luxury check 9 ram reviews 9 ram see user reviews oversized volume tuning knobs may comments cavernous passenger space separators listings near standard liter engine early calendaryear capacity measures lbs materials creature automatic transmission standard operated using rotary shifter knob infotainment system noticeable operation reviews may reproduced distributed publicly displayed used work force modern pickup offroading capability ram certainly even adjustable ride heights aid fuel efficiency offroad ability startling driver design growing bigger becoming lighter might lead sales truck everywhere tons storage generation launched 9 ram new luxury comprise dualzone automatic climate controls sized use wearing gloves impressive research ram boasts streamlined styling unrivaled ride quality th may comments easy,0.0,0.0,0.0,0.0,0.0,0.0,0.0,0.0,1.0
september birthdate calendar person99actress comedienne film producer person9journalist author era leader marge champion9person actress person 99 journalist,0.0,0.0,0.0,0.0,0.0,0.0,0.0,0.0,1.0
due continuous wars knights regularly called battle serve heavy cavalry engaging enemy forces closequarters combat whether mounted knight wears full suit armor cover soldier head toe cumbersome custom made reserved aristocratic knights due generation warfare nowlimited number men able fight noblewomen stepped role battle despite much grumbling conservative lords court women proven quick studies capable fighters indeed wear functional armor man might difficult battlefield discern unnecessary detail whether sword coming ones enemy mans womans hand nation uses heraldry coats arms distinguish warriors battlefield mle trois drives majority relations modern campaigns stags lions falcons become something slang terms describe faction daily life war least aristocratic ladies involves much men sword fights warfare tactics castles supply rules kings queens treaties least one country also made progress using jousting tournament standin bloodier conflicts sparing population needless bloodshed use extraordinarily trained warriors mixed results images collage copyrights belong respective owners go another world advertisements,0.0,0.0,0.0,0.0,0.0,0.0,0.0,0.0,1.0
