text,S,H,V,HR,SH,S3,H2,V2,N
growing abusive family caused want help others didnt want anyone else go defend whether jiujitsu deadpoolesque sense humor person recruited months ago saw kicking ass bank robbers fleeing scene ran sidewalk made drop burrito asses significantly kicked person bought new burrito brought back tower call home many avengers still long mission met bonded organization first introduction person stick ass colorful yet friendly flirting made blush one occasion person walked awkward moments captain person adjusting running room head grin faceafter nd time seeing person became two kind us constantly setting person conversation see bright red cheeks met person harder nut crack waking first night tower jarring first quickly relaxed comfortable bed ever could hear voices coming hall could smell morning coffee got dressed favorite jeans sweater made way kitchen greeting person person open fridge ready steal something resembles yogurt door hits something hard hear grunt closing door come face face person rubbing forehead holy shit youre winter soldier pointing metal limb arm arm oh things would like said fanning face hand persons smirk told thrown bluntness spoke voice went straight core person ask challenge statement enough matching grin since day person flirting back forth never giving one beg training day quickly become favorite specifically seeing sweat dripping one metal armed person walking today saw person punching bag person treadmill person stretching mat sparring day person volunteered show dame done exact words boy got fighting stance person stood throwing soft hits let connect stroke ego bit person came sideline watch almost ruined plan spoke giving best organization replied swift kick persons chest knocking back stepsi letting warm said grin game person came join person watch going head head winter solider getting worked best ways seeing arms moving strength precision massive thigh moving match way shorts hugged ass left nothing imagination front person definitely free balled suddenly back right hook seeing smug soldier standing smirk shows knows got distracted jump feet circle around speak bad guy age persons scowl causes person spit water howling laughter person chuckles well causing person glare laugh way room person stalks towards intense look eyes backing wall boxing arms either side pressing body mine brings lips ear says ii lost footing yyou didnt win shit start getting flustered person move lips neck hovering pulse point feel breath hard chest mine whoa yeah feel serum really enhance moves thigh legs flexes core start moving together bodies pressed close breathing fast tip head back moan person growls finally attaches lips neck kissing biting marking grab biceps contrast hot cold bucky say breathlessly stops pulls back enough separate bodies whine loss please person grab foreheads touching enough tell want person person whispers wanting break moment please person want youhe kisses lips pressed together hard takes hands linking fingers pressing wall pulling away air says told ask,1.0,0.0,0.0,0.0,0.0,0.0,0.0,0.0,0.0
kidding whole reason holodomor like irish potato famine deliberate literally also known terror famine major contributing factors famine include forced collectivization agriculture part soviet first fiveyear plan forced grain procurement combined rapid industrialization former soviet union millions men women children fell victims cruel actions policies totalitarian regime whether holodomor genocide significant issue modern politics international consensus whether soviet policies would fall legal definition genocide,0.0,0.0,0.0,0.0,0.0,0.0,0.0,0.0,1.0
distinction common crimes committed organization forces property course rebellion properly considered indispensable overt acts rebellion logically absorbed virtual ingredients elements thereof common crimes committed civilian population course occasion rebellion furtherance thereof may necessary indispensable committing latter may therefore considered elements said crime rebellion,0.0,0.0,0.0,0.0,0.0,0.0,0.0,0.0,1.0
dont think slavery popular big thing china people living shit conditions rather slaves,0.0,0.0,0.0,0.0,0.0,0.0,0.0,0.0,1.0
practices kissing neighbors neighbors dog squirrel dead bunny left easter person lot one person kingston burp,0.0,0.0,0.0,0.0,0.0,0.0,0.0,0.0,1.0
go right ahead knock title oxymoronno miss white americabut also miss indian america eitherit doesnt really matter heritage isshe born america makes americanher indian heritage even brought upin book either american really appreciate well written articleand yes indian totally agree hope people better understanding instead making racist comments mind people still think america name country entire continent united states found north side american continent rest central america caribbean south america compose know latin america diversity nationalities cultures languages religions habit customs someone mix make single person different rest would much nicer ignored bigoted comments rather dwelling giving bigger audience miss south dakota nordic splendor organization might lamented yet another organization winner unrepresentative newer browner american would equally racist side side note author would count comoros djibouti arab countries arabic influences african arab djibouti mostly somali comoros mix bantu malagasy arab european peoples indeed mostly muslim arabs honor student organization definitely recognize stupidity people actually look black people first come america native americans mothafukas get country organization seems beauty thing white girls,0.0,1.0,0.0,0.0,0.0,0.0,0.0,0.0,0.0
sleepy hollow newbie lucifer could make scary pairing limitedrun series wednesday could contained fall make way empire thursday organization could air twohour masterchef junior episodes incorporate sixhour files miniseries night november sweeps event,0.0,0.0,0.0,0.0,0.0,0.0,0.0,0.0,1.0
number flowers pants number times different guys thought deflowered,0.0,0.0,0.0,1.0,0.0,0.0,0.0,0.0,0.0
jews liberals control media deceived many people nature crime problem america really people also promote lies organization committing horrible crimes american people none true crime problem created within outofcontrol negro population one raised objections civil rights legislation attyt gen persongenn day sen person warned going present legislation would disastrous country got bill disastrous facts permitted know,0.0,1.0,0.0,0.0,0.0,0.0,0.0,0.0,0.0
kinda hard need agree politics order racisthomophobetransphobesetc classroom walked classroom would walking according oppressor class way look character actions irrelevant far goes,0.0,0.0,0.0,0.0,0.0,0.0,0.0,0.0,1.0
ten molest girl barasat agencies yearold girl surrounded group youths abused molested near barasat station friday night chilling parallel stripping girl mob guwahati earlier month rogues also slapped shoved girls father rushed help chased away angry local residents unlike guwahati hapless victim mobs mercy almost half hour two organization molesters arrested place girl attacked near platform addressaddress wasnt far spot person schoolboy murdered february last year tried shield sister call centre employee drunk goons victim class xii student persons organization friend returning home geography tuitions group pounced girls headed overbridge cross noapara banamalipur group seated bench front tea stall first taunted made lewd comments remarks targeted specifically girl first ignored taunts protested barrage abuses refused stop two youths blocked path another tugged hand scared girl called father manhandled molesters fled residents gathered use cookies analytics advertising improve site agree use cookies continuing use site know see cookie policy cookie settings,0.0,0.0,0.0,0.0,0.0,0.0,0.0,0.0,1.0
gtwe study french revolution know january th wasnt attempt seize power lost election lot closer persons march rome anything else,0.0,0.0,0.0,0.0,0.0,0.0,0.0,0.0,1.0
gratis dikke tieten films priveontvangst amsterdam noord sexadvertenties com review nederlandse chatsite tantra massage emmen aftrekken lul sex massaeg ero massage amsterdam geile filpjes tantra massage deventer man zoekt sex met vrouw sex massage drenthe hete poezen lekker geil kutje neuken sex girl massag sensuele massage aan huis belgie gangbang erotische massage duiven gratis sex webcam sexs film nl de perfecte partners dating service beoordelingen hete kutten lekker geil pijpen geile vrouw zoekt man gratis downloaden veel sperma kut amsterdam prive ontvangst gratis sexpunt gratis sex videos vrouw komt klaar film sexfilm nederlandse amateurs sex gangbang lelystad colorado springs gratis chat live seks pinay sex massage aan huis priv vrouwen nederlandse pornofilmpjes kostenlose sexvideos person limburg escort particulier erotische massage heemskerk massages erotisch verbazingwekkend dansers creampie de buurt hulst geile kutjes kijken prive escorte vrouw gratis sexcontacten vrouwen die alleen maar seks willen tepels strelen mooie naakte lesbische vrouwen massage erotisch utrecht erotisch massage rotterdam mensen ontmoeten voor seks nieuwe underwood south dakota coupe afbeelding zoeken seks date nl video nl video download sexafspraak amsterdam massag girl sex vrouwen die gratis seks willen sex sexclub den haag prive ontvangst huisvrouw masturbeert man neukt hoer gay erotische massage warm massage condoom eembrugge erotische massage hasselt gratis sex filmjes sex standje grieks thuisontvangst voor sex wetten op dating minderjarigen utahescort regio limburg dikke tieten tiener privehuis belgie vrouw zoekt vrouw seks waar om te voldoen aan de wenen vrouwen seksverslaving vergaderingen boston lesbisch geil mooie lekkere meiden betaalde sex utrecht tiener orgy geile person kutjes lesbisch geil massgas sex body body masssage ,1.0,0.0,0.0,0.0,0.0,1.0,0.0,0.0,-1.0
 issued organization staff allows organization available investing covered funds long organization participate offer sale ownership interests us residents whats next according chairman organization person amendments provide clarity certainty objectivity around volcker rule tailoring requirements focus banks conduct overwhelming majority trades,0.0,0.0,0.0,0.0,0.0,0.0,0.0,0.0,1.0
cosplay game cosplay surprise looks like one game come netflix casting looks well enough like drawing someone made book description like also acting spot imagination really liked board persons casting beginning acting also convinced shes yennefer even read persons dialogue voice someone loved books games liked casting lot time person also shes ugly looks black mold shes stunning,0.0,0.0,0.0,0.0,0.0,0.0,0.0,0.0,1.0
relation organizations discretion grant bail organization submits finding test rule rules satisfied grant bail country stated prepared accept responsibility accuseds appearance trial charged serious crimes international law evidence may jeopardised potential conspiracy accused persons remain large underestimated,0.0,0.0,0.0,0.0,0.0,0.0,0.0,0.0,1.0
diverse projects reflect localised approaches taken help regenerate communities across country help deliver strong economic social physical outcomes continuation regeneration capital grant fund remainder parliamentary term emphasises joint commitment scottish local government regeneration policy im keen see innovative projects come forward future rounds fund concluded,0.0,0.0,0.0,0.0,0.0,0.0,0.0,0.0,1.0
companys flagship camera em offers number improvements em sibling including responsive focusing four thirds lenses thanks dual fast af system onchip phase contrast detection integrated wifi larger hand grip faster shutter continuous shooting sync speeds focus peaking,0.0,0.0,0.0,0.0,0.0,0.0,0.0,0.0,1.0
recognise indians us consuming within past become early types chili meal buffalo nuts cake patties many others continually influence mesoamerica indians ate essentially equal styles foods twist occurred course time fact spanish ate pigs chickens nuts vegetables cake patties mesoamerica indians created wonderful meals meals mexicans claiming personal actual spelling taco tlahco tlahco aztec spelling meal translated english language mesoamerica indians stated evolved lot known mexican dishes decades real truths misplaced many people never studies origins many stuff located facts wikipedia nobody study perhaps hurtful stroll right mexican restaurant knowing spanish killed aztec nation stole food recipes french fries credited french chinese food credited chinese language pizza lasagna spaghetti credited italians hamburgers hot dogs united states credited mesoamerica indians given credit score food created,0.0,0.0,0.0,0.0,0.0,0.0,0.0,0.0,1.0
need close borders create huge penalties hiring illegal workers prosperity security every us citizen go dramatically hiring illegal workers stopped ones illegally go home amazing shame government patriots tune caring citizens graduate organization school whose history counts club many organization schools understand liberal elitist dogma guiding current leaders first philosophy paper communism support given huge kudos explaining supposed work failed previously,0.0,0.0,0.0,0.0,0.0,0.0,0.0,0.0,1.0
url links check organization patreon url hiring url listen last barracks talk podcast url security sucks podcast url person website url organization url grab official sponsor,0.0,0.0,0.0,0.0,0.0,0.0,0.0,0.0,1.0
gt live bunch pizza boxes watch hentai day wowno need dickalsotry learn better insultsno need jump hentai cause got cute pfp gt listen anyone fox news ah yesthe intellectuals xd alsoi listened people mentioned hoursand never heard saying thata videoalong time stampwould appreciated gt jew taught organization mean persondamnyou must serious problems easier remember jewinstead name,0.0,0.0,0.0,1.0,0.0,0.0,0.0,0.0,0.0
unemployed niggas get bitches factdontargue,0.0,1.0,0.0,0.0,0.0,0.0,0.0,0.0,0.0
psa dont harshly judge someone made mistakes life money perfect either end announcement,0.0,0.0,0.0,0.0,0.0,0.0,0.0,0.0,1.0
disagree lot one hundred million sex workers world thats million men,0.0,0.0,0.0,0.0,0.0,0.0,0.0,0.0,1.0
niggas hoes onhere real life,0.0,1.0,0.0,0.0,0.0,0.0,0.0,0.0,0.0
specifically plaintiffs allege defendant failed provide proper supervision safeguards gave person bike helmet equipment without properly training use allowed person use bike track inappropriate age experience failed obtain parental consent actions,0.0,0.0,0.0,0.0,0.0,0.0,0.0,0.0,1.0
superstraight people absolutely feel sexually attracted trans people without realizing theyre trans,0.0,0.0,0.0,0.0,0.0,0.0,0.0,0.0,1.0
people dont pay living wages arent entitled labour people merely exist years people said dont like making minimum wage dont work minimum wage jobs people choosing work jobs poverty wage everyone surprised pikachu,0.0,0.0,0.0,0.0,0.0,0.0,0.0,0.0,1.0
advertisement continue reading main story aroundtheclock attempts locate individuals certain methods working tirelessly corroborate defendant said prosecutor person told judge person organization according redacted transcript pretrial hearing,0.0,0.0,0.0,0.0,0.0,0.0,0.0,0.0,1.0
immediately graduation mr person entered upon work profession accepting position organization headquarters fort smith arkansas road process construction mr person employed locating line surveys remained concern period six months resigned position order accept lucrative one organization,0.0,0.0,0.0,0.0,0.0,0.0,0.0,0.0,1.0
men almost every women lure makes third category unlike women strict filtering procedure quote quote important factor immediate screening person based hisher appearance quite ironically much money legitimate factor finance comes little later first comes fuck experience say guy friends whenever given opportunity drool girls public places make agenda stretch matter sex sex matter quote quote instance look girl im sure shes great bed see ass maybe god boobies hope real decent docile ones remember ones shag would despise formers universally guys shut already matter staring breasts like offensive shes someones daughterblah blah blah however men call boobs breasts plain gay eyes ones behave like pervie perversons well simply perverts,0.0,0.0,0.0,1.0,0.0,0.0,0.0,0.0,0.0
call whatever want certain things worth fight lifetime id say earth feet people walking qualify dont spreadthelove august theme take time liveinthedetails thecaptionwriter writerscommunity writersofinstagram writersofig writer soul inspire author charlottesville prayforbarcelona findpeace,0.0,0.0,0.0,0.0,0.0,0.0,0.0,0.0,1.0
used word gay slur report telling mod someone called got day ban reason used slur tell mod report called got day ban,0.0,0.0,0.0,0.0,0.0,0.0,0.0,0.0,1.0
uk officials entered phase calling continuous approach talks conscious time pressure uk businesses wanting transition agreement place march prevent triggering contingency plans coming financial year could see move investment activity uk ready work pace across issues implementation period separation issues future seems reciprocated moment first uk official said,0.0,0.0,0.0,0.0,0.0,0.0,0.0,0.0,1.0
jumpsuits kind appear anywhere fallout obtained use however cannot upgraded fallout request thekites combat zone stripper outfit taken plz include bodyslide modpiracy addon gives choice either obtaining dead slave slave pen located requesting one several iterations vault soon several different mods combination chains string insects send chills spine mods one supposedly took artificial lights away making game lot dimmer assigning neck fix issue showing ingame vault jumpsuit fallout lot mods test show im like meh dont feel link using becomes obstruction alcoholic gnomes fucking cumming mxr mods lorefriendly people still practiced shit underground didnt know,0.0,0.0,0.0,0.0,0.0,0.0,0.0,0.0,1.0
honorable person arkansas trial judge sued organization justices person person person person person person person official capacities alleging violated constitutional rights permanently barring presiding death penalty cases,0.0,0.0,0.0,0.0,0.0,0.0,0.0,0.0,1.0
see world workingthey gold make rules capitalism supposed regulated consumers using competition consumers want pay direct labor costs right educated consumers know direct labor costs wholesale price goods made usa nonunion labor,0.0,0.0,0.0,0.0,0.0,0.0,0.0,0.0,1.0
read person organization sole agency charge drug war ra 9 organization lead agency organization organization violates comprehensive dangerous drugs act theres condition person said mix english filipino,0.0,0.0,0.0,0.0,0.0,0.0,0.0,0.0,1.0
us rep person dcalif described safe schools improvement act introduced last month common sense piece legislation measure 9 cosponsors sides aisle needs cosponsors ensure passage house speaker person rohio allows come vote,0.0,0.0,0.0,0.0,0.0,0.0,0.0,0.0,1.0
sapiens brief history humankind new organization times bestsellerfrom renowned historian comes groundbreaking narrative humanitys creation evolutiona international bestsellerthat explores ways biology history defined us enhanced understanding means humanone hundred thousand years ago least six different species humans inhabited earth,0.0,0.0,0.0,0.0,0.0,0.0,0.0,0.0,1.0
oh look one american taliban move middle east freak,0.0,0.0,0.0,1.0,0.0,0.0,0.0,0.0,0.0
watch organization much metre exact distance speed light becomes whole number gt also difficult seriously arguing imperial isnt unit think difficult unit added bullshit ruin metric units,0.0,0.0,0.0,0.0,0.0,0.0,0.0,0.0,1.0
government looking see far go forth brits eat breakfast memoirs admits killing jews many elders balked one really comfortable idea doubt churches would hesitation neighbours love russia trade ass si certains des meilleurs jeux pornos gays gratuits vous placent dans la peau de personnage prdfin site de rencontre gay sexe gratuit ou dicton sur une rencontre marche des fierts lgbti lyon un parcours indit cette anne tags marche des fierts lgbt gay pr published oct important meal day organization network soviet monuments protected back many poles think gays poland rated based 9 review send message les sur anal gay couples porno bon ge sexuels un de gens la sites de rencontres pour femme adulte 9 9 9 9 9 minet beur beur gay tchat minet ttbm,1.0,0.0,0.0,0.0,0.0,0.0,0.0,0.0,0.0
appears hanging friends ask find something lights around take dialogue adapt energy body language coincide family pets type pets definitely type various people thats basic rationale behind show youre family pet enthusiast release caring spirited ambiance eye catching lots people ifyoure mosting likely take route however require really like pet dogs dont fake views welcomes simply unfair fuzzy pals made use like,0.0,0.0,0.0,0.0,0.0,0.0,0.0,0.0,1.0
gtthe fact think black person white supremacistshows idea white supremacy substantiated provided rationale black people cannot espouse white supremacist views thats bit issue white supremacy require holder belief white gtwhite supremacy blatant rhetoric explain something white supremacist rhetoric completely unabashed unapologetic believe white supremacy must unabashed unapologetic required unsubtle mean say dont substantiate beliefs gtwhite supremacy simple racism white supremacy belief white people supreme hence name point trying make gtheres context even heres someone else saying thing theres context education within context virginia race alludes ongoing prominent debate critical race theory way present though implying saying mention education dogwhistle reality statement specific use word relation prominent debate yes decontextualizing statement try make argument made source gtwell reject assertion proof proof assertion proof prove simply asserting something proving man talk bad faith gtgreat whats point identity group intersects meaningfully experience individual individuals meaningfully different within group certain patterns commonalities arise relationship society virtue membership every gay person unique life struggles unlike straight people us come virtue gay gives us experience common gtaccording left dont according left organization reporter left suggest right hivemind gtyoure right thats leftists gtokay cheap shot sorry save apology instead try engage charity good faith gtcase point could say nuance among nazis even technically common agreements inherently vile conservatives liberals common points agreement none nearly vile within organization gtbut still end progressive outcome outcome deviate core beliefs progressivism many progressive outcomes palatable even conservatives thats entire problem see one thing mind deeply polarized outcome reached progressives progressive outcome gt put room force come decision youll get diverse outcome virtue pray tell diverse outcome whatever dont fundamentally believe outcomes better others golden mean golden,0.0,0.0,0.0,0.0,0.0,0.0,0.0,0.0,1.0
tf support things almost exclusively help higher middle class high class,0.0,0.0,0.0,0.0,0.0,0.0,0.0,0.0,1.0
quote may make humble suggestion dont make statements like link reference specific documents even one make comment holocaust anywhere else internet get replies exactly like empty platitudesthey state things like testimonies millions witnesses video evidence thousands pages documentation pictures mass graves look press specific examples get silence things dont actually exist please use empty arguments enemy yes enemy offer something anything specific validated refuted public service announcement different never heard japanese survivor story museum reparations guiltpity sort right wow huge wake call hiroshima nagasaki memorial remembrances disgusting jews would saved israel created wouldnt mass sacrifice children moloch holocaust yep romans used reason wage war carthage third final time years ago destroying semitic phoenicians god person unfortunately survived semitic descendants called jews years continue horrendous legacy death,0.0,1.0,0.0,0.0,0.0,0.0,0.0,0.0,0.0
please need intellectually dishonest know largely leftists conservatives scream leaving country someone dont like potential elected,0.0,0.0,0.0,0.0,0.0,0.0,0.0,0.0,1.0
except hyperboreans nations first arimaspians ever make war upon neighbours issedones pushed lands arimaspians scythians issedones cimmerians dwelling southern sea hard pressed scythians left country,0.0,0.0,0.0,0.0,0.0,0.0,0.0,0.0,1.0
idk leftist honestly dont think reddit bad reddit experience really depends subreddits visit lot subs nice communities nice people,0.0,0.0,0.0,0.0,0.0,0.0,0.0,0.0,1.0
technology providers require multiple servers host large face databases customers still must wait long periods time search results become available government industry attendees gis witnessed highly accurate largescale searches across millions images laptop mobile hardware nearinstantaneous search results,0.0,0.0,0.0,0.0,0.0,0.0,0.0,0.0,1.0
lifetime deal acceptable statement issued behalf organization organization said proposals detailed implications pensions offer within scheme need considered detail within sector specific negotiations alongside issues including proposed contribution increases increases pension age impact indexation change rpi cpi governments position remains unchanged,0.0,0.0,0.0,0.0,0.0,0.0,0.0,0.0,1.0
organization continue west coast swing tonight organization los angeles game scheduled begin pm rookie hurler person set start organization person,0.0,0.0,0.0,0.0,0.0,0.0,0.0,0.0,1.0
check latest price builtin gps continuous heart rate monitor heart rate track workout routes without phone scientific sleep tracking organization organization keeps track light deep rem sleep stages make sleep truly restful workout coach get realtime guidance workout data recovery time vo max nfc organization assistant make payments personal voice assistant wrist music power download listen music organization play music watch,0.0,0.0,0.0,0.0,0.0,0.0,0.0,0.0,1.0
