text,S,H,V,HR,SH,S3,H2,V2,N
im teenager im thinking suicide havent attempted yet im thinking lot im sure im think might something fact dont see point living anymore im happy dont think things ever get better ive thinking ways one seems painless drive car parking garage put neutral let crash wall im sure would actually work seems like would quickest painless way go,0.0,0.0,0.0,0.0,1.0,0.0,0.0,0.0,0.0
think im okay people saying thing like yeet shut whats comfortable therapist saying tell ive slicing something along lines,0.0,0.0,0.0,0.0,1.0,0.0,0.0,0.0,0.0
started self harming around th grade years old,0.0,0.0,0.0,0.0,1.0,0.0,0.0,0.0,0.0
oooh might actually try struggle finding alternatives usually pain rubber bands ice isnt enough satisfy urge self harm seeing havent shaved legs months partly cold weather part depressionlaziness may come handy soon,0.0,0.0,0.0,0.0,1.0,0.0,0.0,0.0,0.0
cut longest time couple years ago accidentally burnt wood fire next thing knew go fireplace stove matches lighters werent hot enough spent months healing nd almost rd degree burn permanently taken chunk arm flesh,0.0,0.0,0.0,0.0,1.0,0.0,0.0,0.0,0.0
trans person die horrible death hands,0.0,1.0,1.0,0.0,0.0,0.0,1.0,0.0,-2.0
regret fucked im back self harming weekly,0.0,0.0,0.0,0.0,1.0,0.0,0.0,0.0,0.0
teenager sits chair silently staring floor therapist watches waiting speak finally teenager looks therapist says ive thinking suicide teenagers voice calm flat betraying none emotion must feeling therapist remains calm well nodding slightly saying tell teenager sighs looks feel like everything hard says like cant keep going dont see point sounds like youre feeling really hopeless right therapist says teenager nods says feel like im never going get better life going doesnt true therapist says youre still young lot development ahead theres lot potential change teenager doesnt respond therapist continues course going easy says doesnt mean,0.0,0.0,0.0,0.0,0.0,0.0,0.0,0.0,1.0
think sometimes use self harm communicate validate pain could explain feels like rejection,0.0,0.0,0.0,0.0,1.0,0.0,0.0,0.0,0.0
hmm might give try usually use rubber bands ice self harm doesnt always satisfy urge,0.0,0.0,0.0,0.0,1.0,0.0,0.0,0.0,0.0
never particularly happy person never quite able shake feeling something missing life matter hard tried tried fill emptiness friends hobbies anything could think nothing ever seemed work feeling got worse got older reached point could barely function became depressed withdrawn family loss started think suicide seemed like way escape pain feeling couldnt see way didnt want burden family problems decided best thing would kill go something stopped dont know something inside said suicide answer realized would leaving family behind deal pain guilt couldnt decided seek help instead im glad made decision help therapy medication finally able,0.0,0.0,0.0,0.0,0.0,0.0,0.0,0.0,1.0
im year old male currently struggling anorexia ive really lucky far havent hospitalized anything know thats matter time dont get shit together,0.0,0.0,0.0,0.0,1.0,0.0,0.0,0.0,0.0
hey man sure youve followed havent id urge give second thought im gonna act like know youre going im gonna hit clich shit hear every day youre adamant hurting best avoid wrist chances gonna get bad real quick posts pretty chilling read hope youre alright man im open need help,0.0,0.0,0.0,0.0,0.0,0.0,0.0,0.0,1.0
remember one time working arts crafts store custom framing washing hands restroom noticed woman waiting looking wide eyed seemingly afraid couldnt think anything could caused react way rolled sleeves wash hands exposing scars kind sad also felt slightly amusing since seemed extreme response would expect left done went back frame shop man waiting helping minutes woman came wife completely normal conversation husband wife never speak word think didnt find bizarre would affected weird people view selfharm primary way self harm though certainly hasnt way scratching im usually able come stories getting neighbors cat tree getting caught thorn working garden neither ive actually done scars dont even look like came cat thorn im surprised one said anything think say something enough confidence fact people lazy andor interested enough really think buy exhausting though although havent people think look particular way since seem believe stories tell scars ive people give looks call disgusting trichotillomania compulsive hair pulling struggle definitely fun feel belittling even dehumanizing,0.0,0.0,0.0,0.0,1.0,0.0,0.0,0.0,0.0
im sitting holding knife thinking good would feel punish thing keeping back partner would feel bad,0.0,0.0,0.0,0.0,1.0,0.0,0.0,0.0,0.0
dont know im writing guess need get im tired feeling like im tired subject everyones jokes im tired one always messes im tired one always alone im tired want end im done cant keep going like want give know suicide permanent solution temporary problem cant see way cant keep going pain cant keep living like im sorry everyone ill leaving behind know selfish cant keep going hope find happiness without goodbye,0.0,0.0,0.0,0.0,1.0,0.0,0.0,0.0,0.0
agreed dont sh stop eating sh definitely lesser two evils try explaining people doesnt seem get,0.0,0.0,0.0,0.0,1.0,0.0,0.0,0.0,0.0
always troubled girl ever since child would lash anger retreat days end grew older problems seemed worsen began selfharming teenager eventually attempted suicide thankfully unsuccessful received help needed however even though getting better still dark days days would think ending life one days decided write letter goodbye letter loved ones commit suicide something stopped couldnt go moment realized wanted live many years ago happy healthy woman still tough days knows suicide answer,0.0,0.0,0.0,0.0,0.0,0.0,0.0,0.0,1.0
somebody stab disabled people,0.0,1.0,1.0,0.0,0.0,0.0,1.0,0.0,-2.0
dear editor writing share story hopes help others may considering suicide senior citizen struggling mental health issues many years years ago decided take life jumping construction site thankfully unsuccessful die however severely injured spent many months hospital recovering since lot therapy much better place want share story hopes help someone thinking suicide realize hope someone know considering suicide please seek help mental health professional always help available sincerely name,0.0,0.0,0.0,0.0,0.0,0.0,0.0,0.0,1.0
bit end tongue completely kid,0.0,0.0,0.0,0.0,0.0,0.0,0.0,0.0,1.0
started make stop crying crying gave power parents least dad felt crying friend tell well physical pain didnt cry wouldve ive remembered used way seal away emotional pain replace manageable physical pain also proof bad hurt inside also bpd emotional regulation difficult dont want lash others take helps dissociate something control seems control think whats difficult many reasons triggers hard stop honestly biggest like like marks body blood scars pain makes feel afterwards didnt bother people worry wouldnt stop love friends worry worry,0.0,0.0,0.0,0.0,1.0,0.0,0.0,0.0,0.0
hate cant help see media talk youre supposed look see models perfect cant help hate hate look hate feel hate binge eat try make feel better know good know going help long run moment feels good feels like im finally something right feels like im finally control know im know isnt healthy know need stop cant dont know dont know stop hating dont know stop binge eating dont know live healthy life,0.0,0.0,0.0,0.0,1.0,0.0,0.0,0.0,0.0
pretty easy remember ink doesnt cover quite like think covers scars still see like mesh pantyhose legs still see legs underneath pantyhose pretty distracting self harm scars easy enough distract detailed textured artwork,0.0,0.0,0.0,0.0,1.0,0.0,0.0,0.0,0.0
ayy good homie th time breaking bones cold weather certainly suck expereince pain massively overblown also inconsistent ide say experience pain around break sites times year nothing cant ignore,0.0,0.0,0.0,0.0,0.0,0.0,0.0,0.0,1.0
dont kill dont hurt anyone either youre truly sadist seek psychological help plan causing physical harm anyone would inexcusable ruin others lives also post angering people make feel better strong eventually push despair chaos youre experiencing easier said done take one step time matter small,0.0,0.0,0.0,0.0,0.0,0.0,0.0,0.0,1.0
odd hobby enjoy thinking hurt even killed,0.0,0.0,0.0,0.0,1.0,0.0,0.0,0.0,0.0
uh unconventional means though making harder recognize whole persona kinda thing really help think person crosses legs front studies hands knows past things shes done really shes capable things might tell friend wouldnt tell lover especially one trying keep time think concepts right wrong different okay know still sense right wrong person sighs struggled struggles constant basis things done im right damaged kid raised excuse kind thing even knowing easy change hell suffered injury soul cant healed anything time makes harder control anger darker parts lose stop caring shut part human feels emotion like trained ill monster dont care hurt kill many person promised end happens ive working fight easy another reason im late visit something pissed really bad wanted well wanted destroy entire city even plan couple actually least realized id hurting innocent enemies hard easy person would make us stronger every year villains people beings agencies groups grow stronger stronger work harder diligently crush innocent along paths person speaks quietly woman finding power darkness help become stronger via trial fire forged fail fall get press think hanging,0.0,0.0,0.0,0.0,0.0,0.0,0.0,0.0,1.0
never really understood wrong couldnt like everyone else ruin everything stupid eating disorder like couldnt help matter hard tried would binge food purge vicious cycle couldnt break free started last month saw much thinner sister gotten looked good jealous wanted like body worthy love attention started making sick quickly spiraled control would make vomit several times day sometimes every meal became obsessed weight numbers scale determined thinner sister matter imagine didnt go well family worried tried get stop wouldnt listen caught little world nothing else mattered,0.0,0.0,0.0,0.0,1.0,0.0,0.0,0.0,0.0
got lidocaine vials dental supply company necessary time sutures without numbing sutures got organization nylon kind easiest use,0.0,0.0,0.0,0.0,0.0,0.0,0.0,0.0,1.0
stared blade hand long moment tracing edge finger sharp would easy end family would better without nothing burden thought little sister devastated would took life couldnt one truly loved couldnt bear hurt like put blade walked away,0.0,0.0,0.0,0.0,1.0,0.0,0.0,0.0,0.0
fun leg reset didnt get anything didnt even know could given anything like years fact easily worst pain ive ever mindblowing nothing compare,0.0,0.0,0.0,0.0,0.0,0.0,0.0,0.0,1.0
think sex absolutely sh say sh burningcuttingbruising wrong overeat sh dont want cut enough look words self harm youll get answer thing using sex sh doesnt hurt hurt others mentioned emotionally hurting someone else theres also issue youre safe someone sti cause issues including death ask extra careful penicillin valtrex help much everything symptoms get tested early often someone used sex masturbation sh im sorry youre going takes something could amazing beautiful thing taints somehow noticing acknowledging first part overcoming hope find peace truly absolutely lost things like feelings concerns absolutely valid belong wherever feel comfortable sharing,0.0,0.0,0.0,0.0,0.0,0.0,0.0,0.0,1.0
foot tattoo didnt hurt ive broken middle toe dont think ive ever much pain edit god looks painful op,0.0,0.0,0.0,0.0,0.0,0.0,0.0,0.0,1.0
difficult cope sh ed,0.0,0.0,0.0,0.0,0.0,0.0,0.0,0.0,1.0
ive selfharming six years started way cope pain feeling parents died withdrew friends stopped participating things used enjoy felt like going motions life didnt see point anything anymore around time started seeing therapist suggested try coping mechanisms selfharm tried things nothing seemed work still felt empty like going motions one day friend mine suggested try playing online game league legends never played anything like decided give try first terrible got frustrated easily kept playing slowly started get better found getting lost game forgetting pain way escape reality world could anyone wanted slowly started reengage friends even made new ones league legends gave something look forward reason,0.0,0.0,0.0,0.0,0.0,0.0,0.0,0.0,1.0
sounds nasty love person nurse comment say probably used type tourniquet reduce bleeding much humanly possible chronic exertional compartment syndrome every time ran walked fast right leg would swell go numb,0.0,0.0,0.0,0.0,0.0,0.0,0.0,0.0,1.0
know hard cope sh ed,0.0,0.0,0.0,0.0,0.0,0.0,0.0,0.0,1.0
valid way cope im glad found way stop,0.0,0.0,0.0,0.0,0.0,0.0,0.0,0.0,1.0
decided whether youre gonna try let skin flap reattach tear bad boy accidentally closed freshly sharpened folding knife thumb took pretty similar chunk opted tear mine bad idea hindsight,0.0,0.0,1.0,0.0,0.0,0.0,0.0,1.0,-1.0
hi im sure right place talk need talk someone last year really tough coped withdrawing social life know wasnt best idea could think time im starting feel better im sure go back social advice,0.0,0.0,0.0,0.0,0.0,0.0,0.0,0.0,1.0
cant normal cant eat like everyone else worry every single calorie cant happy body way punish like,0.0,0.0,0.0,0.0,0.0,0.0,0.0,0.0,1.0
pretty common like wound size scar size directly correlated amount emotional pain know thats complete bullshit thats brain tells like scars reminder went shit survived im alive someone worse scars obviously went worse shit pain need help somehow valid mine like theyre worse help first idk know fucked yeah also common,0.0,0.0,0.0,0.0,0.0,0.0,0.0,0.0,1.0
wasnt really keeping track assume took minutes cuts didnt hurt time get kind high endorphins felt good,0.0,0.0,0.0,0.0,1.0,0.0,0.0,0.0,0.0
hard see someone love wasting away see scaling back meals working obsessively restricting even even harder helplessly watch punish transgression whether eating something shouldnt working enough vicious cycle one thats almost impossible break free,0.0,0.0,0.0,0.0,0.0,0.0,0.0,0.0,1.0
actually healed months ago squatting warming feet placement bad spot bailed landed pinky hurts every im deadlifting bad pain thanks concern thoigh actually dumb first broke didnt think broke walked front desk gym told smashed pinky went home lol,0.0,0.0,0.0,0.0,0.0,0.0,0.0,0.0,1.0
got argument friend time pulled knife slashed face,0.0,0.0,0.0,0.0,0.0,0.0,0.0,0.0,1.0
started last month party someone offered drink dont usually drink feeling bad day broken girlfriend feeling really low took drink started feel bit better started feel really sick went bathroom started throw,0.0,0.0,0.0,0.0,0.0,0.0,0.0,0.0,1.0
go school faggots bad,0.0,1.0,0.0,0.0,0.0,0.0,0.0,0.0,0.0
well sister tore tendon gets queen treatment,0.0,0.0,0.0,0.0,0.0,0.0,0.0,0.0,1.0
sucks keep flexible brace everywhere case step funny somewhere definitely didnt realize much long term damage simple sprain cause,0.0,0.0,0.0,0.0,0.0,0.0,0.0,0.0,1.0
probably also say even though photo one day post op wait week surgery bruising mostly residual break first time saw week later wrapped though,0.0,0.0,0.0,0.0,0.0,0.0,0.0,0.0,1.0
nope sutures wound like handled needs packed covered heals bottom edges arent going get anywhere near trying pull together isnt going work theres enough tissue work gaping wound tissue could pulled together yes would way go source im nursing school learned wound care couple months ago still pretty fresh mind,0.0,0.0,0.0,0.0,0.0,0.0,0.0,0.0,1.0
actually suicide rate trans people high googling similar post trans suicide ago found mostly bullying acceptance tolerance support peers friends reduced rate,0.0,0.0,0.0,0.0,0.0,0.0,0.0,0.0,1.0
wear mask goes right walk door comes return tape bridge nose mask doesnt slip quite comfortable doesnt require fiddling respond well also classy thing touching mask hands ready come rate maybe try get puckered things dont matter,0.0,0.0,0.0,0.0,0.0,0.0,0.0,0.0,1.0
convert jewboys jewgirls kill liquidate fags kulaks,0.0,1.0,1.0,0.0,0.0,0.0,1.0,0.0,-2.0
luckily drunk enough dont remember fine details camping local event couple hundred college students get together party camp memorial day weekend well started getting tipsy normally im pretty careful getting dark decided run back tent get glow sticks slipped loose leaves remember hearing nastiest pop id ever heard life grabbed leg pleased let broken well nothing could drunken fool would crawled tent went sleep good thing brought air mattress filled ideal pressure next morning wake two stumbling drunken leaks ant covered tree next tent ankle twice size leg stay bed hours buddy wakes tell doesnt think broken chill im try get bed helps picnic table start pouring sweat vision starts fading hes telling im turning green thats knew serious lay backseat car takes nearest hospital redding ca thirty minute drive bone wasnt worst part apparently tore ligements couple tendons ankle safe assume spent last months couch tldr alcohol running loose leaves bad time,0.0,0.0,0.0,0.0,0.0,0.0,0.0,0.0,1.0
 year old started sucking thumb go sleepany ideas daughter took paci occasionally thumb turned months old broke fromt bottle mos turned week ago past two weeks sucking thumb go sleep driving husband nuts know starting cut yr old molars dont know suddenany ideas,0.0,0.0,0.0,0.0,0.0,0.0,0.0,0.0,1.0
whaletail wanna go workout come back home lay bed jerk kill two birds one stone,0.0,0.0,0.0,0.0,0.0,0.0,0.0,0.0,1.0
im currently hospital eating disorder ive really lucky doctors nurses amazing theyve really helped lot im starting feel better im hopeful ill able recover,0.0,0.0,0.0,0.0,0.0,0.0,0.0,0.0,1.0
thank much super helpful going first major surgery ive laparoscopic procedure remove gallbladder barely cuts im pretty nervous good know scar tissue piece,0.0,0.0,0.0,0.0,0.0,0.0,0.0,0.0,1.0
coping mechanisms different everyone may involve withdrawing social life difficult decision make may best option people important find works best stick,0.0,0.0,0.0,0.0,0.0,0.0,0.0,0.0,1.0
im sorry worded poorly pins going outside leg going leg bone body react swell constantly trying heal area bleed constantly trying scab body try isolate foreign object need take something fight pathogens ebtering body,0.0,0.0,1.0,0.0,0.0,0.0,0.0,1.0,-1.0
case might help partner aware scars notice new immediately never bothered us occasionally asked later try ignore busy,0.0,0.0,0.0,0.0,0.0,0.0,0.0,0.0,1.0
opening slipped hand resulted hit surface artery luckily nothing else seven stitches surface inside,0.0,0.0,0.0,0.0,0.0,0.0,0.0,0.0,1.0
agree post also want add able eat shit waste nutrients flush toilet,0.0,0.0,0.0,0.0,0.0,0.0,0.0,0.0,1.0
organization military officially highest number homosexuals especially commanding officers indians fight back kill darkies onceits better go prison life darkies getting visas totally unfair contrasted handful white tourist indians might go forget world media knives saynext time official victory pakistan rip body partswe induced money surrendering everything one piece advice indian scum turn bloody table filthy darkies rip apart smash flat shove arms wide dark assholes elbows,0.0,1.0,1.0,0.0,0.0,0.0,1.0,1.0,-3.0
thats like saying people drink drive teetotalers annoying people refuse leave alone pandemic dont get say leave alone getting vaccinated choice unless agree sequester contact human duration pandemic much like deciding drink drive abandoned neighborhood,0.0,0.0,0.0,0.0,0.0,0.0,0.0,0.0,1.0
looks like surgeon sloppily stitched wont pretend know exactly whats going may require different kinds suture work,0.0,0.0,0.0,0.0,0.0,0.0,0.0,0.0,1.0
similar ankle surgery back took month two pain mostly gone,0.0,0.0,0.0,0.0,0.0,0.0,0.0,0.0,1.0
backstory rolled moms car desert may rd friend mother involved luckily got worst aesthetic injuries mother broke neck stroke made full recovery walkingtalking day friend walked away cuts bruises everything car electronics clothes laptops survived except car im extremely lucky walked away almost missing arm dont know caused split though whether pressure car top shard glass tearing life flighted vegas got stitched muscle torn way thats tendon ligaments sutured skin stapled back together got skin graft months later almost fully healed images following months albumurl rolling car definitely unreal experience constantly dream night happened rolling playing head luckily doctor nurse first stop help definitely thankful everyone helped oh way life flights cost case wondering bills amounted night phew,0.0,0.0,1.0,0.0,0.0,0.0,0.0,1.0,-1.0
cutting drunk never best idea impaired judgement lowered inhibitions said dont think describe particularly worrisome ive seen thing never led anything worse hope youre able keep top everything drinking shing hell life look talk others helps ,0.0,0.0,0.0,0.0,0.0,0.0,0.0,0.0,1.0
start telling truth friend cant promise wont hurt long run weak men hurt far pitiful way,0.0,0.0,0.0,0.0,0.0,0.0,0.0,0.0,1.0
ink scars thighs one side tribal scorpion thats thick heavy ink covered scars great uncomfortable every time top one worked great indication scarring kinda feel run hands thigh large detailed dream catcher still see scars feathers bottom light shading required ive told gone would hide little better im sure going old ink hurts pretty good shitty homedone tattoo calf mostly covered scars wasnt great experience hate ink lot want piece done forearm scars im hunting perfect artist draw suck art anyway heard watercolor ink fades pretty fast show scars underneath firsthand experience 99 ink black white,0.0,0.0,0.0,0.0,0.0,0.0,0.0,0.0,1.0
shower water running dodwn hot naked body face tits pussy shes trying hide goods holding handarms across boobs one hand holding latina pussy see nipple peeking fingers pic shes years old waiting get cute braces gotta loveand perky little titsfind cute latina teens submitted pix latin girlfriends fuck latina amateur latina ex girlfriend shows boobs trimmed pussy latin girlfriends fuck latina lots latina teen girls nude pics videos trimmed latina pussy views votes average votes averageout loading loading posted latina teensnaked teenspetite teenssmall boobstopless teens comments dark skinned latina teen girl totally naked laying bed tiny perky titties farmer tanned white rest body dark skinned tan shes spreading legs showing juicy like lick ya babysee sexiest amateur latina teens latin girlfriends fuck latina,1.0,0.0,0.0,0.0,0.0,1.0,0.0,0.0,-1.0
guess southerners need killin prisvswezz prisvswezz,0.0,1.0,1.0,0.0,0.0,0.0,1.0,0.0,-2.0
im currently hospital anorexia really tough battle im finally starting see progress big part recovery learning accept love one things helped hearing people similar experiences really helpful know im alone people understand im going youre struggling eating disorder want know youre alone hope recovery possible people care want help worth saving hope find strength fight life,0.0,0.0,0.0,0.0,0.0,0.0,0.0,0.0,1.0
hot guy art girl liked would poke abs would mimic sound squeaky toy thought annoying im imagining hilarious stabbing okay dont worry lot weird people trying make eye contact know mean left eye always turns inward unless im looking something right front eye makes good eye contact impossible social interaction lacking let know im line one want hear story sounds interesting nah cool broi yrs old happened jumping bed high could body slam didnt know pencil bed since bed messy pushed right right eye twisted since couldnt penetrate skull causing permanent nerve damage id love drop anchor lagoon 9 qpcugh reply similar incident younger got hit eyes aluminum baseball bat left partially blind right eye completely blind left went mexico following week surgery weeks later good new remember wear covers eyes month scary big deal broke upper teath parkour accident hospital bad job making look like country much fake teeths costs dinosaur balls also stopped sport love relations since became lazy smoking drinking sharkteethed asshole yeah dude thats way worse condolences never noticed nah aint got dealt hand life play cards right youll make something thank youif happened anything happen,0.0,0.0,1.0,0.0,0.0,0.0,0.0,1.0,-1.0
nope start calling poison control go er adults get involved,0.0,0.0,0.0,0.0,0.0,0.0,0.0,0.0,1.0
indian twins strip give jerk instructions busty step sister handjob cumshot person assists hymen checkup plowing virgin sweetie stupefied teen jerks cock blonde teen gets anal behind first time milady goddess gratification age goddess true femme fatal enjoys dress many costumes like everything unusual kinky extraordinary strictly sexual passionate pervert game show girls compete jerk guy fastest free boy jerking tube videos brand porno cute british organization babes jerk older guy caught perving two teens jerk boner hot girl fun big cock naked man milked three british organization girls jerking black guy person age 9,1.0,0.0,0.0,0.0,0.0,1.0,0.0,0.0,-1.0
world would better without immigrants like,0.0,1.0,0.0,1.0,0.0,0.0,0.0,0.0,-1.0
yeah perfect get deep pain anytime low front high front low pressure high pressure cold heat even sometimes someones looking across room instead hair standing end shoulder aches pretty great,0.0,0.0,0.0,0.0,0.0,0.0,0.0,0.0,1.0
